results/metrics.csv

ML Model Name,Accuracy,AUC,Precision,Recall,F1 Score,MCC
Logistic Regression,0.9824561403508771,0.9953703703703703,0.9861111111111112,0.9861111111111112,0.9861111111111112,0.9623015873015873
Decision Tree,0.9210526315789473,0.9163359788359788,0.9565217391304348,0.9166666666666666,0.9361702127659575,0.8341403959394523
KNN,0.956140350877193,0.9788359788359788,0.958904109589041,0.9722222222222222,0.9655172413793104,0.9054466190452621
Naive Bayes,0.9298245614035088,0.9867724867724867,0.9444444444444444,0.9444444444444444,0.9444444444444444,0.8492063492063492
Support Vector Machine,0.9824561403508771,0.9950396825396826,0.9861111111111112,0.9861111111111112,0.9861111111111112,0.9623015873015873

README.md

### Observations

**Logistic Regression:** Achieved 98.25% accuracy and 99.54% AUC. It correctly classified 112 out of 114 test samples.

**Decision Tree:** Achieved 92.11% accuracy and correctly classified 105 samples.

**KNN:** Achieved 95.61% accuracy and correctly classified 109 samples.

**Naive Bayes:** Achieved 92.98% accuracy and 98.68% AUC. It correctly classified 106 samples.

**Support Vector Machine:** Achieved 98.25% accuracy and correctly classified 112 samples. Its performance was very close to Logistic Regression.